{
  "$schema": "http://json-schema.org/draft-04/schema#",
  "itemType": "iic",
  "type": "object",
  "id": "Placeholder",
  "properties": {
    "version": {
      "id": "version",
      "type": "string",
      "title": "version",
      "mediaType": "text",
      "hidden": true,
      "disabled": true
    },
    "itemName": {
      "id": "itemName",
      "type": "string",
      "title": "itemName",
      "mediaType": "text",
      "hidden": true,
      "disabled": true
    },
    "itemType": {
      "id": "itemType",
      "type": "string",
      "title": "itemType",
      "mediaType": "text",
      "hidden": true,
      "disabled": true
    },
    "params0001": {
      "id": "params0001",
      "type": "object",
      "properties": {
        "content": {
          "type": "string",
          "title": "params0001",
          "mediaType": "html",
          "hidden": false,
          "disabled": false
        }
      }
    },
    "paramId0001": {
      "id": "paramId0001",
      "type": "object",
      "properties": {
        "content": {
          "type": "string",
          "title": "paramId0001",
          "mediaType": "html",
          "hidden": false,
          "disabled": false
        }
      }
    },
    "paramId0002": {
      "id": "paramId0002",
      "type": "object",
      "properties": {
        "content": {
          "type": "string",
          "title": "paramId0002",
          "mediaType": "html",
          "hidden": false,
          "disabled": false
        }
      }
    },
    "paramId0003": {
      "id": "paramId0003",
      "type": "object",
      "properties": {
        "content": {
          "type": "string",
          "title": "paramId0003",
          "mediaType": "html",
          "hidden": false,
          "disabled": false
        }
      }
    },
    "paramId0004": {
      "id": "paramId0004",
      "type": "object",
      "properties": {
        "content": {
          "type": "string",
          "title": "paramId0004",
          "mediaType": "html",
          "hidden": false,
          "disabled": false
        }
      }
    }
  }
}
