{
  "version": "1.0",
  "itemName": "Popover",
  "itemType": "iic",
  "paramId0001": {
    "content": "PopoverResponse",
    "ref": "",
    "scene": "scene1"
  },
  "paramId0002": {
    "content": "Popover",
    "ref": "",
    "scene": "scene1"
  },
  "paramId0003": {
    "content": "Popover Button",
    "ref": "",
    "scene": "scene1"
  },
  "paramId0004": {
    "content": "Hello There!",
    "ref": "",
    "scene": "scene1"
  }
}
